<?xml version="1.0" encoding="UTF-8"?>
<sections anonymousMode="true" xmlns="http://www.example.org/sections-fields-configuration"
          xmlns:xsi="http://www.w3.org/2001/XMLSchema-instance"
          xsi:schemaLocation="http://www.example.org/sections-fields-configuration sections-fields-configuration.xsd ">

  
  <section id="divisionalApplicationSection" description="DIVISIONAL APPLICATION SECTION">
    <view-state-id>oneform</view-state-id>
    <view-state-order>1</view-state-order>
    <coreName></coreName>
    <visible>false</visible>
    <order>2</order>
    <path>/WEB-INF/views/divisional_application_section.jsp</path>
    <navigationPath>false</navigationPath>    
    <previousCTMImportable>true</previousCTMImportable>
    <priorityImportable>false</priorityImportable>
    <seniorityImportable>false</seniorityImportable>
    <transformationImportable>false</transformationImportable>
    <generalImportable>false</generalImportable>	 
    <field id="claimDivisionalApplication">
    	<visible>true</visible>
    	<required>false</required> 
		<previousCTMImportable>true</previousCTMImportable>
	    <priorityImportable>true</priorityImportable>
	    <seniorityImportable>true</seniorityImportable>
	    <transformationImportable>true</transformationImportable>
	    <generalImportable>true</generalImportable>	    
    	<format></format>
    </field>
    <field id="numberDivisionalApplication">
    	<visible>true</visible>
    	<required>false</required> 
		<previousCTMImportable>true</previousCTMImportable>
	    <priorityImportable>true</priorityImportable>
	    <seniorityImportable>true</seniorityImportable>
	    <transformationImportable>true</transformationImportable>
	    <generalImportable>true</generalImportable>	    
    	<format></format>
    </field>
    <field id="dateDivisionalApplication">
    	<visible>true</visible>
    	<required>false</required> 
		<previousCTMImportable>true</previousCTMImportable>
	    <priorityImportable>true</priorityImportable>
	    <seniorityImportable>true</seniorityImportable>
	    <transformationImportable>true</transformationImportable>
	    <generalImportable>true</generalImportable>	    
    	<format></format>
    </field>    
  </section>
  
  <section id="previousCTM" description="DISPLAYS PREVIOUS CTM SECTION">
    <view-state-id>oneform</view-state-id>
    <view-state-order>1</view-state-order>
    <coreName></coreName>
    <visible>true</visible>
    <order>1</order>
    <path>/WEB-INF/views/previousCtm/previousCtm.jsp</path>
    <navigationPath>false</navigationPath>
    <field id="applicationId">
    	<visible>true</visible>
    	<required>false</required> 
		<previousCTMImportable>false</previousCTMImportable>
	    <priorityImportable>false</priorityImportable>
	    <seniorityImportable>false</seniorityImportable>
	    <transformationImportable>false</transformationImportable>
	    <generalImportable>false</generalImportable>	    
    	<format></format>
    </field>
  </section>
  
  
  <section id="claim" description="DISPLAYS CLAIM SECTIONS (CONTAINS SUBSECTIONS)">
    <view-state-id>oneform</view-state-id>
    <view-state-order>1</view-state-order>
    <coreName></coreName>
    <visible>true</visible>
    <order>2</order>
    <path>claim_section_oneform</path>
    <navigationPath>false</navigationPath>
    
    <subsection id="priority" description="SUBSECTION WHICH CONTAINS THE CLAIM PRIORITY FORM">
	    <view-state-id>oneform</view-state-id>
	    <view-state-order>1</view-state-order>
	    <coreName>Priority</coreName>
	    <visible>true</visible>
	    <order>1</order>
	    <path>/WEB-INF/views/claim/claim_priority_section.jsp</path>
	    <navigationPath>false</navigationPath>
	    <previousCTMImportable>true</previousCTMImportable>
	    <priorityImportable>false</priorityImportable>
	    <seniorityImportable>true</seniorityImportable>
	    <transformationImportable>true</transformationImportable>
	    <generalImportable>false</generalImportable>	    
	    <field id="date">
	    	<visible>true</visible>
	    	<required>false</required> 
   		    <previousCTMImportable>true</previousCTMImportable>
		    <priorityImportable>true</priorityImportable>
		    <seniorityImportable>true</seniorityImportable>
		    <transformationImportable>true</transformationImportable>
		    <generalImportable>true</generalImportable>	    
		    <editableImport>false</editableImport>
	    	<format>^(0[1-9]|[12][0-9]|3[01])[- /.](0[1-9]|1[012])[- /.](19|20)\d\d$</format>
	    </field>
	    <field id="number">    	
	    	<visible>true</visible>
	    	<required>false</required>  
   		    <previousCTMImportable>true</previousCTMImportable>
		    <priorityImportable>true</priorityImportable>
		    <seniorityImportable>true</seniorityImportable>
		    <transformationImportable>true</transformationImportable>
		    <generalImportable>true</generalImportable>	 
		    <editableImport>false</editableImport>
	    	<format></format>	    	
	    </field>
	    <field id="country">    	
	    	<visible>true</visible>
	    	<required>true</required>  
   		    <previousCTMImportable>true</previousCTMImportable>
		    <priorityImportable>true</priorityImportable>
		    <seniorityImportable>true</seniorityImportable>
		    <transformationImportable>true</transformationImportable>
		    <generalImportable>true</generalImportable>	 
		    <editableImport>false</editableImport>
	    	<format></format>
	    </field>
	    <field id="fileWrapperCopy">
	    	<visible>true</visible>
	    	<required>false</required>  
   		    <previousCTMImportable>false</previousCTMImportable>
		    <priorityImportable>false</priorityImportable>
		    <seniorityImportable>false</seniorityImportable>
		    <transformationImportable>false</transformationImportable>
		    <generalImportable>false</generalImportable>	 
	    </field>
	    <field id="fileWrapperTranslation">
	    	<visible>true</visible>
	    	<required>false</required>  
   		    <previousCTMImportable>false</previousCTMImportable>
		    <priorityImportable>false</priorityImportable>
		    <seniorityImportable>false</seniorityImportable>
		    <transformationImportable>false</transformationImportable>
		    <generalImportable>false</generalImportable>	 
	    </field>
	    <field id="filePriorityCertificate">
	    	<visible>false</visible>
	    	<required>false</required>  
   		    <previousCTMImportable>false</previousCTMImportable>
		    <priorityImportable>false</priorityImportable>
		    <seniorityImportable>false</seniorityImportable>
		    <transformationImportable>false</transformationImportable>
		    <generalImportable>false</generalImportable>	 
	    </field>    
    </subsection>
    
    <subsection id="seniority" description="SUBSECTION WHICH CONTAINS THE CLAIM SENIORITY FORM">
	    <view-state-id>oneform</view-state-id>
	    <view-state-order>1</view-state-order>
	    <coreName>Seniority</coreName>
	    <visible>true</visible>
	    <order>2</order>
	    <path>/WEB-INF/views/claim/claim_seniority_section.jsp</path>
	    <navigationPath>false</navigationPath>	    
   	    <previousCTMImportable>true</previousCTMImportable>
	    <priorityImportable>true</priorityImportable>
	    <seniorityImportable>false</seniorityImportable>
	    <transformationImportable>true</transformationImportable>
	    <generalImportable>false</generalImportable>	 
	    <field id="country">    	
	    	<visible>true</visible>
	    	<required>true</required>  
   		    <previousCTMImportable>true</previousCTMImportable>
		    <priorityImportable>true</priorityImportable>
		    <seniorityImportable>true</seniorityImportable>
		    <transformationImportable>true</transformationImportable>
		    <editableImport>false</editableImport>
		    <generalImportable>true</generalImportable>	 
	    	<format></format>
	    </field>
	    <field id="nature">    	
	    	<visible>true</visible>
	    	<required>true</required>  
   		    <previousCTMImportable>true</previousCTMImportable>
		    <priorityImportable>true</priorityImportable>
		    <seniorityImportable>true</seniorityImportable>
		    <transformationImportable>true</transformationImportable>
		    <editableImport>true</editableImport>
		    <generalImportable>true</generalImportable>			    
	    	<format></format>
	    </field>
	    <field id="filingDate">    	
	    	<visible>true</visible>
	    	<required>true</required>  
   		    <previousCTMImportable>true</previousCTMImportable>
		    <priorityImportable>true</priorityImportable>
		    <seniorityImportable>true</seniorityImportable>
		    <transformationImportable>true</transformationImportable>
		    <generalImportable>true</generalImportable>	 
		    <editableImport>false</editableImport>
	    	<format>^(0[1-9]|[12][0-9]|3[01])[- /.](0[1-9]|1[012])[- /.](19|20)\d\d$</format>
	    </field>
	    <field id="filingNumber">    	
	    	<visible>true</visible>
	    	<required>false</required>  
   		    <previousCTMImportable>true</previousCTMImportable>
		    <priorityImportable>true</priorityImportable>
		    <seniorityImportable>true</seniorityImportable>
		    <transformationImportable>true</transformationImportable>
		    <generalImportable>true</generalImportable>	 
		    <editableImport>false</editableImport>
	    	<format></format>
	    </field>
	    <field id="registrationDate">    	
	    	<visible>true</visible>
	    	<required>false</required>  
   		    <previousCTMImportable>true</previousCTMImportable>
		    <priorityImportable>true</priorityImportable>
		    <seniorityImportable>false</seniorityImportable>
		    <transformationImportable>true</transformationImportable>
		    <generalImportable>true</generalImportable>	 
	    	<format>^(0[1-9]|[12][0-9]|3[01])[- /.](0[1-9]|1[012])[- /.](19|20)\d\d$</format>
	    </field>
	    <field id="registrationNumber">    	
	    	<visible>true</visible>
	    	<required>true</required>  
   		    <previousCTMImportable>true</previousCTMImportable>
		    <priorityImportable>true</priorityImportable>